{
  "$schema": "https://json-schema.org/draft/2020-12/schema",
  "$id": "orderfield/residual.schema.json",
  "title": "Orderfield residual",
  "type": "object",
  "additionalProperties": false,
  "required": ["status", "result_ref", "residual", "metrics"],
  "properties": {
    "v": {
      "type": "integer",
      "description": "Ignored document version. Kernel --json reports emit this; residuals may mirror it."
    },
    "packet_id": { "type": "string" },
    "packet_hash": { "type": "string" },
    "order_id": { "type": "string" },
    "order_rev": { "type": "integer", "minimum": 1 },
    "wave": { "type": "integer", "minimum": 1 },
    "child_id": { "type": "string" },
    "role": { "type": "string" },
    "status": { "type": "string", "enum": ["done", "blocked", "threshold"] },
    "result_ref": { "type": "string" },
    "residual": {
      "type": "object",
      "additionalProperties": false,
      "required": ["wants_to_change", "evidence", "proposed_patch"],
      "properties": {
        "wants_to_change": {
          "type": "array",
          "items": {
            "type": "string",
            "enum": ["mission", "phase", "constraints", "done_when", "workspace"]
          }
        },
        "evidence": { "type": "string" },
        "proposed_patch": {
          "type": ["object", "null"],
          "additionalProperties": true,
          "properties": {
            "constraints+": {
              "type": "array",
              "items": { "type": "string" }
            },
            "done_when+": {
              "type": "array",
              "items": { "type": "string" }
            },
            "notes": { "type": "string" },
            "docs_sync": {
              "type": "string",
              "enum": ["pending", "done"],
              "description": "PlanDocSync mark. pending|done. Lives here; not a close gate."
            },
            "done_when_closed": { "type": "boolean" },
            "requirements_verified": {
              "type": "array",
              "items": { "type": "string" }
            },
            "requirements_failed": {
              "type": "array",
              "items": { "type": "string" }
            }
          }
        }
      }
    },
    "metrics": {
      "type": "object",
      "additionalProperties": false,
      "required": ["uncertainty", "divergence", "tool_failures", "novelty"],
      "properties": {
        "uncertainty": { "type": "number", "minimum": 0, "maximum": 1 },
        "divergence": { "type": "number", "minimum": 0, "maximum": 1 },
        "tool_failures": { "type": "integer", "minimum": 0 },
        "novelty": { "type": "boolean" }
      }
    },
    "usage": {
      "type": ["object", "null"],
      "additionalProperties": false,
      "description": "Optional harness-reported model/token facts. Provenance like origin.session_id, not a budget. Never compared to budget.tokens. Omit or null when the harness did not report any.",
      "properties": {
        "tokens": { "type": "integer", "minimum": 0 },
        "model": {
          "type": "string",
          "minLength": 1,
          "pattern": "^[A-Za-z0-9][A-Za-z0-9._:/-]{0,127}$"
        }
      }
    },
    "denied_actions": {
      "type": "array",
      "description": "Optional harness-reported refused tools (agy JSON denied_actions under conservative trust). Provenance, not approval. Omit when the harness did not report any. Empty is not approval — do not invent [].",
      "items": {
        "type": "string",
        "minLength": 1,
        "maxLength": 256
      }
    },
    "session_id": {
      "type": "string",
      "minLength": 1,
      "description": "Optional harness-reported session id. Adapter resume/continue reads this key only. Omit when unknown. Never invent. Never resume a cold residual."
    }
  }
}
